"名称","名称カナ","住所","TEL","FAX","URL","備考","備考２","備考３","備考４","備考５","経度","緯度","分類"
"中央図書館","","神奈川県横須賀市上町1-61","046-822-2202","046-823-4200","http://www.city.yokosuka.kanagawa.jp/8150/sisetu/fc00000374.html","【開館時間】９時３０分～７時２０分（祝日を除く木・金曜日は１９時２０分）【休館日】・月曜日・第４木曜日（１２月及び図書整理期間が含まれる月を除く。祝日の場合は翌日）・図書整理期間 ・年末年始（１２月２９日～１月３日）","","","","","139.668183076942","35.274454339775","図書館"
"児童図書館","","神奈川県横須賀市若松町3-20","046-825-4417","046-825-7309","http://www.city.yokosuka.kanagawa.jp/8150/sisetu/fc00000377.html","【開館時間】９時３０分～１７時２０分【休館日】・月曜日・第４木曜日（１２月及び図書整理期間が含まれる月を除く。祝日の場合は翌日）・図書整理期間・年末年始（１２月２９日～１月３日）","","","","","139.671172773654","35.2778738608068","図書館"
"北図書館","","神奈川県横須賀市夏島町12","046-866-0516","046-866-0696","http://www.city.yokosuka.kanagawa.jp/8150/sisetu/fc00000375.html","【開館時間】９時３０分～１７時２０分（祝日を除く木・金曜日は１９時２０分）【休館日】・月曜日・第４木曜日（１２月及び図書整理期間が含まれる月を除く。祝日の場合は翌日）・図書整理期間・年末年始（１２月２９日～１月３日）","","","","","139.632277195726","35.3186417741247","図書館"
"南図書館","","神奈川県横須賀市久里浜6-14-3","046-836-0718","046-836-0374","http://www.city.yokosuka.kanagawa.jp/8150/sisetu/fc00000376.html","【開館時間】９時３０分～１７時２０分（祝日を除く木・金曜日は１９時２０分）【休館日】・月曜日・第４木曜日（１２月及び図書整理期間が含まれる月を除く。祝日の場合は翌日）・図書整理期間・年末年始（１２月２９日～１月３日）","","","","","139.706089901833","35.2270490674084","図書館"
"点字図書館","テンジトショカン","神奈川県横須賀市本町2-1 総合福祉会館４階","046-822-6712","046-822-6712","https://www.city.yokosuka.kanagawa.jp/2625/sisetu/fc10000912.html","【開館時間】午前８：３０～午後５：００【休館日】土・日曜日、祝日、年末年始（12月29日～1月3日）【利用者の範囲】市内に居住・通勤・通学する視覚障害者","","","","","139.665243355042","35.2826336578231","図書館"
